Titel;Link
Vaudoise trotz Corona optimistisch;<a href=https://www.nzz.ch/wirtschaft/vaudoise-trotz-corona-optimistisch-ld.1548422>link</a>
Die Schweiz stoppt Ausschaffungen von Asylbewerbern – erster Corona-Fall im Bundeszentrum Zürich;<a href=https://www.nzz.ch/schweiz/die-schweiz-stoppt-ausschaffungen-von-asylbewerbern-erster-corona-fall-im-bundeszentrum-zuerich-ld.1548486>link</a>
Die Corona-Krise wird die Welt neu gestalten. Schlägt nun die Stunde des Superstaates?;<a href=https://www.nzz.ch/meinung/wie-die-corona-krise-das-leben-von-uns-allen-veraendern-wird-ld.1548661>link</a>
WHO-Direktor sagt warnend: «Afrika muss sich auf das Schlimmste vorbereiten»;<a href=https://www.nzz.ch/international/corona-in-afrika-muss-sich-auf-das-schlimmste-vorbereiten-ld.1547333>link</a>
Ernstfalleinsatz an der Corona-Front: Ein Spitalsoldat berichtet;<a href=https://www.nzz.ch/schweiz/ernstfall-einsatz-an-der-corona-front-ld.1548616>link</a>
Corona-Einsatz führt zu einer kritischen Doppelbelastung der Berufsmilitärs;<a href=https://www.nzz.ch/schweiz/corona-einsatz-fuehrt-zu-doppelbelastung-der-berufsmilitaers-und-der-verwaltung-ld1548177-ld.1548177>link</a>
Pensionskassen erleiden einen «Corona-Schock»;<a href=https://www.nzz.ch/finanzen/corona-und-pensionskassen-schweizer-kassen-unter-schock-ld.1548222>link</a>
«Die Erwerbstätigen sind die grossen Verlierer, die Rentner die grossen Gewinner der Krise»;<a href=https://www.nzz.ch/finanzen/corona-und-pensionskassen-anlagen-ueberzeugen-nicht-ld.1548250>link</a>
Ein Doktorand trägt in der Freizeit die Corona-Fallzahlen aus den Kantonen zusammen. Ist das Ergebnis besser als die offizielle Statistik des Bundes?;<a href=https://www.nzz.ch/technologie/daten-corona-ld.1548610>link</a>
Olympische Spiele im Jahr der Corona-Krise: Die IOK-Führung hat bereits versagt;<a href=https://www.nzz.ch/meinung/olympische-spiele-im-jahr-der-corona-krise-die-iok-fuehrung-hat-bereits-versagt-ld.1548045>link</a>
Der US-Arbeitsmarkt erlebt einen Schock wie noch nie;<a href=https://www.nzz.ch/wirtschaft/ein-schock-wie-noch-nie-fuer-den-us-arbeitsmarkt-ld.1548665>link</a>
Wenn Knappheit über Leben und Tod entscheidet;<a href=https://www.nzz.ch/meinung/corona-das-ressourcenmanagement-entscheidet-ueber-leben-und-tod-ld.1548718>link</a>
EU-Videokonferenz: «Corona-Bonds» sind keine gute Lösung;<a href=https://www.nzz.ch/meinung/eu-videokonferenz-corona-bonds-sind-keine-gute-loesung-ld.1548806>link</a>
Die Corona-Krise trifft die Migros in einer heiklen Phase;<a href=https://www.nzz.ch/wirtschaft/die-corona-krise-trifft-die-migros-in-einer-heiklen-phase-ld.1548181>link</a>
Netanyahu gibt sich als Krisenmanager und hebelt dabei Israels demokratische Institutionen aus;<a href=https://www.nzz.ch/international/israel-regierungschef-zeigt-in-corona-krise-haerte-ld.1548240>link</a>
