Keyword: ;Corona
04:48:20;20/03/2020;Ausmass des Schadens ist riesig: Corona-Krise bedroht Existenz von Campussaal-Betreiber;Kathrin Kalt, Co-Geschäftsführerin von Campussaal Kultur + Kongresse in Brugg-Windisch, sagt, dass die Corona-Krise das Aus für den Betrieb bedeuten...;https://www.aargauerzeitung.ch/aargau/brugg/ausmass-des-schadens-ist-riesig-corona-krise-bedroht-existenz-von-campussaal-betreiber-137193151&sa=U&ved=2ahUKEwj6mP_fwKnoAhXJT8AKHXDyBb84qgEQxfQBMAF6BAgIEAE&usg=AOvVaw2fBbmhFVKVwqCSl_fQMMpQ
04:48:20;20/03/2020;Ausmass des Schadens ist riesig: Corona-Krise bedroht Existenz von Campussaal-Betreiber;Kathrin Kalt, Co-Geschäftsführerin von Campussaal Kultur + Kongresse in Brugg-Windisch, sagt, dass die Corona-Krise das Aus für den Betrieb bedeuten...;https://www.aargauerzeitung.ch/aargau/brugg/ausmass-des-schadens-ist-riesig-corona-krise-bedroht-existenz-von-campussaal-betreiber-137193151&sa=U&ved=2ahUKEwii-dbhwKnoAhUNCZoKHZQoCd04vgEQxfQBMAB6BAgDEAE&usg=AOvVaw0ootjyhufhqMbxJmgIRczw
04:48:20;20/03/2020;Das Corona-Virus hat mich erwischt;Ich oute mich: Ich bin ein Opfer des Corona-Virus. Ich huste, ich niese, meine Atemwege verschliessen sich langsam und ich leide. Dabei habe ich mich brav an...;https://www.solothurnerzeitung.ch/kommentare-soz/das-corona-virus-hat-mich-erwischt-137192702&sa=U&ved=2ahUKEwjNhs_mwKnoAhV7wsQBHUYMB1s4-gEQxfQBMAl6BAgDEAE&usg=AOvVaw3-ruKtsKYUrWlON2EU2PvP
03:48:20;20/03/2020;Jetzt sind es 272 Corona-Fälle in Basel-Stadt – Intensivstationen der Spitäler fahren Kapazitäten hoch;Der Kanton Basel-Stadt verzeichnet Stand Freitagmittag 272 positiv getestete Corona-Fälle. Das sind 50 mehr als am Vortag. Es bleibt allerdings zurzeit bei den...;https://www.bzbasel.ch/basel/basel-stadt/jetzt-sind-es-272-corona-faelle-in-basel-stadt-intensivstationen-der-spitaeler-fahren-kapazitaeten-hoch-137172452&sa=U&ved=2ahUKEwiFn6jLwKnoAhXOe30KHcQFBc0QxfQBMAh6BAgAEAE&usg=AOvVaw1mmk1kJFsXt0Rqs9-jPJpY
03:48:20;20/03/2020;Kalifornien: 25 Mio. Corona-Infizierte?;Beim US-Kongress hat Newsom Bundeshilfen in Höhe von einer Milliarde Dollar für medizinische Versorgung und andere Hilfen während der Corona-Krise...;https://www.zentralplus.ch/kalifornien-25-mio-corona-infizierte-1754715/&sa=U&ved=2ahUKEwj6mP_fwKnoAhXJT8AKHXDyBb84qgEQxfQBMAN6BAgHEAE&usg=AOvVaw3dYyRN023kF6y51gPVmtqx
03:48:20;20/03/2020;Kalifornien: 25 Mio. Corona-Infizierte?;Beim US-Kongress hat Newsom Bundeshilfen in Höhe von einer Milliarde Dollar für medizinische Versorgung und andere Hilfen während der Corona-Krise...;https://www.zentralplus.ch/kalifornien-25-mio-corona-infizierte-1754715/&sa=U&ved=2ahUKEwjm_ungwKnoAhUv0aYKHS31BVM4tAEQxfQBMAd6BAgBEAE&usg=AOvVaw1HNiMkfJgiXTvaTGuMR3lK
02:48:20;20/03/2020;Zweiter Corona-Todesfall in Rheinland-Pfalz | SWR Aktuell Rheinland-Pfalz | SWR Aktuell;Wie der Kreis Mayen-Koblenz mitteilt, ist gestern ein 80-jähriger Mann aus dem Landkreis an den Folgen einer Corona-Infektion gestorben. Der Mann war...;https://www.swr.de/swraktuell/rheinland-pfalz/erster-corona-todesfall-100.html&sa=U&ved=2ahUKEwjuq5fkwKnoAhX7w8QBHQmjCYg43AEQxfQBMAF6BAgJEAE&usg=AOvVaw2zbdOFsNSgsoLwZFNZ3nJO
02:48:20;20/03/2020;„Wie ein Idiot” — Elon Musk im Kreuzfeuer der Corona-Kritik;„Wie ein Idiot” — Elon Musk im Kreuzfeuer der Corona-Kritik. Kolumne. Der Tesla-Chef bietet nach Vorwürfen seine Hilfe an. Außerdem: Uber blickt selbstsicher in...;https://www.gruenderszene.de/business/wie-ein-idiot-elon-musk-im-kreuzfeuer-coronavirus-kritik-uber-softbank-oneweb-slack-microsoft-netflix&sa=U&ved=2ahUKEwjPpuflwKnoAhUgw8QBHSzvBKM48AEQxfQBMAl6BAgFEAE&usg=AOvVaw3u4ET08MSIL1HT4nYLvhJn
02:48:20;20/03/2020;„Wie ein Idiot” — Elon Musk im Kreuzfeuer der Corona-Kritik;„Wie ein Idiot” — Elon Musk im Kreuzfeuer der Corona-Kritik. Kolumne. Der Tesla-Chef bietet nach Vorwürfen seine Hilfe an. Außerdem: Uber blickt selbstsicher in...;https://www.gruenderszene.de/business/wie-ein-idiot-elon-musk-im-kreuzfeuer-coronavirus-kritik-uber-softbank-oneweb-slack-microsoft-netflix&sa=U&ved=2ahUKEwjNhs_mwKnoAhV7wsQBHUYMB1s4-gEQxfQBMAB6BAgBEAE&usg=AOvVaw2AuF-Xmq6QL_LrjN4mSCMr
01:48:20;20/03/2020;"""Virus teilt Zeitrechnung in vorher und nachher ein"": Presse zu ...";Die Corona-Krise ordnet die Welt neu. Es werde auch eine Zeit danach geben, schreibt eine Zeitung. Aber dann wird das Virus die Zeitrechnung neu eingeteilt...;https://www.tt.com/artikel/30724260/virus-teilt-zeitrechnung-in-vorher-und-nachher-ein-presse-zu-corona-krise&sa=U&ved=2ahUKEwjru_3pwKnoAhXHG5oKHXLOAyw4ogIQxfQBMAV6BAgFEAE&usg=AOvVaw1724X7eTGM_nqJaGjxzBsB
00:48:20;20/03/2020;Der Corona-Ausbruch legt Amerikas kaputtes System offen;Der Corona-Ausbruch legt Amerikas kaputtes System offen. Die Pandemie wird die USA härter treffen als viele andere Länder. Daran ist nicht nur Trump schuld,...;https://www.tagesanzeiger.ch/ausland/amerika/der-coronaausbruch-legt-amerikas-kaputtes-system-offen/story/14249906&sa=U&ved=2ahUKEwiowYfWwKnoAhVBdCsKHUZ-BQo4PBDF9AEwB3oECAEQAQ&usg=AOvVaw2nOw3k2PDQU_YLuFEAYMpw
00:48:20;20/03/2020;Studentin gründet Corona-Hilfe;Sophie Bucher gründete «Corona Hilfe Oberwallis». Foto: RZ. Quelle: RZ 20.03.20 0. Die...;https://1815.ch/rhonezeitung/zeitung/region/studentin-gruendet-corona-hilfe-155818/&sa=U&ved=2ahUKEwjGx9PZwKnoAhWHG5oKHf66D8w4WhDF9AEwBnoECAUQAQ&usg=AOvVaw25Rv_U0Pxcg9wdp2g_Gpjm
00:48:20;20/03/2020;Wie eine Schülerin die Corona-Pandemie erlebt;Das Corona-Virus hat uns alle nun komplett im Griff. Wenn jemand im Bus niest oder hustet, wird rasch das Weite gesucht, in den noch geöffneten Läden steht...;https://www.nfz.ch/2020/03/wie-eine-sch%25C3%25BClerin-die-corona-pandemie-erlebt.html&sa=U&ved=2ahUKEwjPpuflwKnoAhUgw8QBHSzvBKM48AEQxfQBMAZ6BAgBEAE&usg=AOvVaw1xyF3QQVxqcenxBU8K007H
23:48:20;19/03/2020;Videostreamingdienst - Wegen Corona: Netflix muss Übertragunsrate in Europa herunterfahren;EU-Industriekommissar Thierry Breton hatte Netflix zuvor gedrängt, die Übertragungsrate seine Videostreams herunterzufahren. Das Internet ist stark belastet,...;https://www.cash.ch/news/politik/videostreamingdienst-wegen-corona-netflix-muss-uebertragunsrate-europa-herunterfahren-1505562&sa=U&ved=2ahUKEwjD9NLQwKnoAhVZAXIKHdB0Dys4HhDF9AEwBHoECAIQAQ&usg=AOvVaw1KvsP-BEpEx8mMVbvCaFzM
23:48:20;19/03/2020;Corona-Live-Ticker: Weltweit steigende Zahlen, drastische Maßnahmen;Italien meldet inzwischen mehr Corona-Todesfälle als China und in Deutschland könnte es schärfere Maßnahmen geben. Die Stadt Freiburg muss schon jetzt...;https://www.dw.com/de/corona-live-ticker-weltweit-steigende-zahlen-drastische-ma%25C3%259Fnahmen/a-52833637&sa=U&ved=2ahUKEwiRnqDbwKnoAhVfQEEAHRJdBYo4bhDF9AEwA3oECAkQAQ&usg=AOvVaw2Yv6-983IqMApC4RhZB30t
23:48:20;19/03/2020;Corona-Massnahmen: Die Gefahr, dass es zu häuslicher Gewalt ...;Corona-Massnahmen: Die Gefahr, dass es zu häuslicher Gewalt kommt, steigt. Fachleute gehen davon aus, dass es aufgrund von Verunsicherung, Isolation...;https://www.bazonline.ch/basel/stadt/coronamassnahmen-die-gefahr-dass-es-zu-haeuslicher-gewalt-kommt-steigt/story/17870070&sa=U&ved=2ahUKEwii-dbhwKnoAhUNCZoKHZQoCd04vgEQxfQBMAV6BAgEEAE&usg=AOvVaw0qp8IcB5evgkFpqjdXHElj
22:48:20;19/03/2020;EZB legt Corona-Notprogramm auf;Die Europäische Zentralbank beschliesst im Kampf gegen die wirtschaftlichen Folgen der Corona-Krise weitere Massnahmen zur Stützung der Wirtschaft.;https://www.cash.ch/fonds-news/partner-news/ezb-legt-corona-notprogramm-auf-1505552&sa=U&ved=2ahUKEwiO3LzSwKnoAhXBX30KHaZQA7Q4KBDF9AEwBHoECAAQAQ&usg=AOvVaw2gn9xEf-YgIqzBoHn5BXZe
22:48:20;19/03/2020;Profitieren Doper wirklich von Corona?;Denn der Basler Alex Wilson, EM-Dritter über 200 Meter, sagt dem Online-Portal dieser Zeitung: «Wegen der Corona-Pandemie will jetzt doch niemand testen.;https://www.bazonline.ch/sport/leichtathletik/profitieren-doper-wirklich-vom-coronavirus/story/31801542&sa=U&ved=2ahUKEwijrezYwKnoAhVS0aYKHWLCAYg4UBDF9AEwBXoECAUQAQ&usg=AOvVaw0XSGYXc2xMs_7TwnZEm8WZ
22:48:20;19/03/2020;Corona-Krise: Finma sieht Banken operationell und finanziell gut gerüstet;Die Finma stellt den Finanzinstituten und der Finanzmarktinfrastruktur vor dem Hintergrund der Corona-Krise ein gutes Zeugnis aus. Die Institute würden...;https://www.cash.ch/fonds-news/partner-news/corona-krise-finma-sieht-banken-operationell-und-finanziell-gut-geruestet-1505548&sa=U&ved=2ahUKEwijrezYwKnoAhVS0aYKHWLCAYg4UBDF9AEwBnoECAMQAQ&usg=AOvVaw0G6-NhVS181JQ1NYAhI7SB
22:48:20;19/03/2020;Niemand muss wissen, wo genau Corona-Patienten wohnen;MeinungVOGELSBERG. 15 Corona-Patienten im Kreis. Vier aus dem östlichen Kreisgebiet, drei aus dem südöstlichen Kreisgebiet, zwei Patienten im...;https://www.oberhessen-live.de/2020/03/19/niemand-muss-wissen-wo-genau-corona-patienten-wohnen/&sa=U&ved=2ahUKEwjQoL_awKnoAhWmw6YKHVFgDWQ4ZBDF9AEwAnoECAgQAQ&usg=AOvVaw3lSTH3DZuQLOuTIZ8YJ6uu
22:48:20;19/03/2020;Papst betet für Corona-Betroffene | International;CORONAVIRUS - ITALIEN ⋅ Papst Franziskus hat sich am Donnerstag per Video an einem von der italienischen Bischofskonferenz organisierten landesweiten...;https://www.bote.ch/nachrichten/international/papst-betet-fuer-corona-betroffene%3Bart46446,1230549&sa=U&ved=2ahUKEwiRnqDbwKnoAhVfQEEAHRJdBYo4bhDF9AEwCHoECAMQAQ&usg=AOvVaw124Pnt1cMd1hGjRW4gpv9R
22:48:20;19/03/2020;Zofinger Tagblatt;Ob es sich so anfühlt, wenn bei Infizierten der Corona-Virus ausbricht? Ich halte auf dem nächsten Zwischenboden an, verschnaufe und bin dankbar, dass...;https://www.zofingertagblatt.ch/%3Fid%3D285772%261150%2BStufen%2Bzum%2BNachdenken%2B%25C3%25BCber%2Bden%2BCorona-Virus&sa=U&ved=2ahUKEwjP_MPiwKnoAhUs86YKHfHsB7U4yAEQxfQBMAl6BAgAEAE&usg=AOvVaw2SkmlirIzsnx4C8XvFswF_
22:48:20;19/03/2020;Zofinger Tagblatt;Ob es sich so anfühlt, wenn bei Infizierten der Corona-Virus ausbricht? Ich halte auf dem nächsten Zwischenboden an, verschnaufe und bin dankbar, dass...;https://www.zofingertagblatt.ch/%3Fid%3D285772%261150%2BStufen%2Bzum%2BNachdenken%2B%25C3%25BCber%2Bden%2BCorona-Virus&sa=U&ved=2ahUKEwjEpK7jwKnoAhXj8KYKHVy2A-440gEQxfQBMAF6BAgJEAE&usg=AOvVaw2lAnP0eT6XYFPMExNUBSRI
21:48:20;19/03/2020;International Italien meldet mehr Tote als China bei Corona-Pandemie;In Italien sind 427 neue Corona-Tote in den letzten 24 Stunden gemeldet worden. Somit liegt die Anzahl Todesopfer bei 3405. Das sind mehr als in China.;https://telebasel.ch/2020/03/19/italien-meldet-mehr-tote-als-china-bei-corona-pandemie/&sa=U&ved=2ahUKEwiFtY3NwKnoAhVCWysKHQvUCLI4ChDF9AEwBnoECAAQAQ&usg=AOvVaw2Xt7puq9sJXCZgqCjZM5pL
21:48:20;19/03/2020;So testet das Spital Herisau die möglichen Corona-Patienten;Darin werden mögliche Corona-Patienten getestet. TVO hat sich in einem solchen Container umgesehen. «Was haben Sie für Beschwerden?» Das ist die erste...;https://www.fm1today.ch/ostschweiz/appenzellerland/so-testet-das-spital-herisau-die-moeglichen-corona-patienten-137198094&sa=U&ved=2ahUKEwiowYfWwKnoAhVBdCsKHUZ-BQo4PBDF9AEwBXoECAIQAQ&usg=AOvVaw3YXiKHIZLc54f8e7kVGhhc
21:48:20;19/03/2020;Kinderkram: Das mit Corona ist nicht mehr lustig | St.Galler Tagblatt;Die Zeit ist vorbei, über das Corona-Virus Witze zu machen. Diese Tage sind spannend und herausfordernd. Katharina Rutz 19.03.2020, 21.04 Uhr.;https://www.tagblatt.ch/ostschweiz/werdenberg/kinderkram-das-mit-corona-ist-nicht-mehr-lustig-ld.1205938&sa=U&ved=2ahUKEwii-dbhwKnoAhUNCZoKHZQoCd04vgEQxfQBMAh6BAgGEAE&usg=AOvVaw1Vw9zHnIYOt7qWg1RieAlN
21:48:20;19/03/2020;"""Muss mit Massensterben rechnen"":Was, wenn Corona nach Syrien kommt?";"""Muss mit Massensterben rechnen"" Was, wenn Corona nach Syrien kommt? Von Dirk Emmerich. RTS34G08.jpg. Ärzte vor einer Operation an einem Verwundeten...";https://www.n-tv.de/politik/Was-wenn-Corona-nach-Syrien-kommt-article21654843.html&sa=U&ved=2ahUKEwjEpK7jwKnoAhXj8KYKHVy2A-440gEQxfQBMAl6BAgAEAE&usg=AOvVaw16H0-7Fk3aMB7P5nx4_lYq
21:48:20;19/03/2020;Corona setzt Flüchtlingskinder fest;Corona setzt Flüchtlingskinder fest. Einige EU-Staaten wollten minderjährige Flüchtlinge von den griechischen Inseln aufnehmen. Doch Luxemburgs...;https://www.dw.com/de/corona-setzt-fl%25C3%25BCchtlingskinder-fest/a-52845534&sa=U&ved=2ahUKEwjuq5fkwKnoAhX7w8QBHQmjCYg43AEQxfQBMAB6BAgBEAE&usg=AOvVaw2_uTTwnmV03b7sG-lcIKy3
21:48:20;19/03/2020;USA prüfen Malariamittel gegen Corona;Ein bestehendes Malariamittel wird in den USA nun auch als Medikament gegen Coronavirus-Erkrankungen geprüft. US-Präsident Donald Trump sagte, die...;https://www.zentralplus.ch/usa-pruefen-malariamittel-gegen-corona-1754647/&sa=U&ved=2ahUKEwjuq5fkwKnoAhX7w8QBHQmjCYg43AEQxfQBMAV6BAgCEAE&usg=AOvVaw2Gq9M7GXT5MiZVnj1bSgOc
21:48:20;19/03/2020;Nun bereits 688 Corona-Infizierte in Berlin;Wie die Senatsgesundheitsverwaltung Donnerstagabend bekannt gab, sind Stand 19. März um 16.30 Uhr bereits 688 Fälle des Coronavirus bestätigt.;https://www.bz-berlin.de/berlin/aktuelle-zahlen-donnerstag-nun-bereits-688-corona-infizierte-in-berlin&sa=U&ved=2ahUKEwjuq5fkwKnoAhX7w8QBHQmjCYg43AEQxfQBMAh6BAgEEAE&usg=AOvVaw0iFXV3okQpbWhTFE6iH3ia
21:48:20;19/03/2020;Nun bereits 688 Corona-Infizierte in Berlin;Wie die Senatsgesundheitsverwaltung Donnerstagabend bekannt gab, sind Stand 19. März um 16.30 Uhr bereits 688 Fälle des Coronavirus bestätigt.;https://www.bz-berlin.de/berlin/aktuelle-zahlen-donnerstag-nun-bereits-688-corona-infizierte-in-berlin&sa=U&ved=2ahUKEwiv0P7kwKnoAhVRzqYKHdWHDk045gEQxfQBMAF6BAgHEAE&usg=AOvVaw3QvTWgPxcswoDEljCn8-xh
21:48:20;19/03/2020;180.000 Corona-Tests bei wallonischer Firma beschlagnahmt;Die Polizei und der Katastrophenschutz haben bei einem Unternehmen in der Provinz Lüttich 180.000 Corona-Tests und eine Menge Reagenzien zur Herstellung...;https://www.grenzecho.net/33431/artikel/2020-03-19/180000-corona-tests-bei-wallonischer-firma-beschlagnahmt&sa=U&ved=2ahUKEwjru_3pwKnoAhXHG5oKHXLOAyw4ogIQxfQBMAd6BAgDEAE&usg=AOvVaw1Ccwwws2KDlN_pJkVhxlzM
20:48:20;19/03/2020;Corona-News aus der Zentralschweiz vom 19. März 2020;Zentralschweizer Corona-News: Welttheater Einsiedeln verschoben ++ Corona-Tests vor der Mall ++ Ausgangseinschränkung für Ü65 in Uri. Das Corona-Virus...;https://www.luzernerzeitung.ch/zentralschweiz/zentralschweizer-corona-news-19-maerz-2020-ld.1205563&sa=U&ved=2ahUKEwj7t53UwKnoAhWRb30KHV8iBJc4MhDF9AEwB3oECAQQAQ&usg=AOvVaw1p357pJItLu99HvPaAG-Sm
20:48:20;19/03/2020;Polizeikommandant zu Corona - «Befolgt doch bitte diese ...;Polizeikommandant zu Corona - «Befolgt doch bitte diese Verordnung, steht nicht unnötig herum». Heute, 12:33 Uhr...;https://www.srf.ch/news/schweiz/polizeikommandant-zu-corona-befolgt-doch-bitte-diese-verordnung-steht-nicht-unnoetig-herum&sa=U&ved=2ahUKEwjs3OvXwKnoAhUOdCsKHUpMDyo4RhDF9AEwAXoECAcQAQ&usg=AOvVaw06dKMHvnQpMhD_EGlZI0Gf
20:48:20;19/03/2020;"Virologe Stürmer: ""Die Dynamik der Corona-Krise wird jetzt sehr stark""";Die Zahl der Corona-Infizierten in Hessen steigt rapide. So rasch wird sich das nach Einschätzung des Frankfurter Virologen Martin Stürmer nicht ändern.;https://www.hessenschau.de/panorama/virologe-stuermer-die-dynamik-der-corona-krise-wird-jetzt-sehr-stark,corona-virologe-stuermer-100.html&sa=U&ved=2ahUKEwijrezYwKnoAhVS0aYKHWLCAYg4UBDF9AEwAnoECAkQAQ&usg=AOvVaw2GmbPbQtfMGJh7u6CBKkGQ
20:48:20;19/03/2020;Johnson hofft auf Erfolg gegen Corona bis Anfang Sommer;Johnson hofft auf Erfolg gegen Corona bis Anfang Sommer. Der britische Premierminister Boris Johnson hofft, dass der Coronavirus-Ausbruch in seinem Land bis...;https://www.cash.ch/news/politik/johnson-hofft-auf-erfolg-gegen-corona-bis-anfang-sommer-1505472&sa=U&ved=2ahUKEwjQoL_awKnoAhWmw6YKHVFgDWQ4ZBDF9AEwBHoECAEQAQ&usg=AOvVaw013Wo1Uk1KMhjxqSMQjrw1
20:48:20;19/03/2020;Kurzarbeit wegen Corona-Krise auch bei VW-Kernmarke;Kurzarbeit wegen Corona-Krise auch bei VW-Kernmarke. (Ausführliche Fassung) - Die wachsende Ansteckungsgefahr und die drastischen wirtschaftlichen...;https://www.cash.ch/news/boersenticker-firmen/kurzarbeit-wegen-corona-krise-auch-bei-vw-kernmarke-1505494&sa=U&ved=2ahUKEwiRnqDbwKnoAhVfQEEAHRJdBYo4bhDF9AEwAnoECAcQAQ&usg=AOvVaw05Ic2p7iGwcaXgS6EPl_9R
20:48:20;19/03/2020;Corona-News aus der Zentralschweiz vom 19. März 2020;Zentralschweizer Corona-News: Welttheater Einsiedeln verschoben ++ Corona-Tests vor der Mall ++ Ausgangseinschränkung für Ü65 in Uri. Das Corona-Virus...;https://www.luzernerzeitung.ch/zentralschweiz/zentralschweizer-corona-news-19-maerz-2020-ld.1205563&sa=U&ved=2ahUKEwiE883dwKnoAhWEmFwKHeBFByg4jAEQxfQBMAF6BAgJEAE&usg=AOvVaw0Ob086At44pWTu6fu1oOX4
20:48:20;19/03/2020;So meistern Mutter und Tochter in Altdorf die Corona-Krise | Luzerner Zeitung;Cornelia Baumann aus Altdorf und ihre Tochter Livia organisieren sich wegen der Corona-Krise. Bild: Christian Tschümperlin (Altdorf, 17. März 2020). Auf ihrem...;https://www.luzernerzeitung.ch/zentralschweiz/uri/so-meistern-mutter-und-tochter-die-krise-ld.1205823&sa=U&ved=2ahUKEwjn3q_ewKnoAhXRh1wKHRVyC6Q4lgEQxfQBMAB6BAgEEAE&usg=AOvVaw3psg_Y4Eo-_H49jK0jOeVb
20:48:20;19/03/2020;Großzügig: 9400 Dollar Trinkgeld wegen Corona;Großzügig: 9400 Dollar Trinkgeld wegen Corona. Nette Geste: Ein Pärchen unterstützt Gastro-Personal in den USA mit einem großzügigen Trinkgeld. facebook;https://kurier.at/freizeit/trending/grosszuegig-9400-dollar-trinkgeld-wegen-corona/400787105&sa=U&ved=2ahUKEwjP_MPiwKnoAhUs86YKHfHsB7U4yAEQxfQBMAR6BAgFEAE&usg=AOvVaw0akzbSZiereO4f-eFwNy8E
20:48:20;19/03/2020;Corona in MV: Landesregierung beschließt weitere Maßnahmen;Die Zahl der Corona-Infektionen im Land ist auf 142 gestiegen. Das teilte Ministerpräsidentin Manuela Schwesig (SPD) bei einem Pressetermin mit. Damit erhöhte...;https://www.ndr.de/nachrichten/mecklenburg-vorpommern/Corona-Behindertenwerkstaetten-in-MV-sollen-schliessen,coronavirus656.html&sa=U&ved=2ahUKEwjgurjnwKnoAhVMPJoKHbRmD9o4hAIQxfQBMAJ6BAgIEAE&usg=AOvVaw0SxDu5xzQHHyhV1jWV-y5W
19:48:20;19/03/2020;Weise Voraussicht und gefährliche Nähe: Wie Baustellen mit dem Corona-Virus umgehen | Luzerner Zeitung;Ein Handwerker klagt, dass klare Corona-Hygienevorschriften auf seiner Baustelle fehlen – es gibt aber auch positive Beispiele. Marco Morosoli 19.03.2020,...;https://www.luzernerzeitung.ch/zentralschweiz/zug/weise-voraussicht-und-gefaehrliche-naehe-wie-baustellen-mit-dem-corona-virus-umgehen-ld.1205864&sa=U&ved=2ahUKEwiowYfWwKnoAhVBdCsKHUZ-BQo4PBDF9AEwBHoECAYQAQ&usg=AOvVaw0MCTAi3SG3NLHIIkeC1-Qz
19:48:20;19/03/2020;Corona-Epidemie im Südkanton - 15 Tote, über 600 Infizierte: Lage ...;Corona-Epidemie im Südkanton - 15 Tote, über 600 Infizierte: Lage im Tessin spitzt sich zu. Das Tessin wird als erster Kanton von der Coronawelle erfasst.;https://www.srf.ch/news/schweiz/corona-epidemie-im-suedkanton-15-tote-ueber-600-infizierte-lage-im-tessin-spitzt-sich-zu&sa=U&ved=2ahUKEwiowYfWwKnoAhVBdCsKHUZ-BQo4PBDF9AEwBnoECAMQAQ&usg=AOvVaw3anymcu_mEtDuP4QGvBUQB
19:48:20;19/03/2020;Rekordergebnis für Basel-Stadt: Jetzt will die neue Finanzdirektorin in der Corona-Krise helfen;Und befände sich Basel-Stadt nicht auch im Griff der Corona-Krise, hätten die Neuigkeiten aus dem Finanzdepartement eine ganz andere öffentliche Wirkung...;https://www.bzbasel.ch/basel/basel-stadt/rekordergebnis-fuer-basel-stadt-jetzt-will-die-neue-finanzdirektorin-in-der-corona-krise-helfen-137194251&sa=U&ved=2ahUKEwijrezYwKnoAhVS0aYKHWLCAYg4UBDF9AEwA3oECAgQAQ&usg=AOvVaw2ulFjOl7cSpcl680EASI7t
19:48:20;19/03/2020;Chinas radikale Kur gegen Corona-Virus zeigt Wirkung | Luzerner Zeitung;Chinesische Pfleger desinfizieren Behandlungsplätze für Corona-Patienten. Bild: AP. Es ist ein dramatischer Wendepunkt im Verlauf der Virus-Pandemie:...;https://www.luzernerzeitung.ch/international/chinas-radikale-kur-gegen-corona-virus-zeigt-wirkung-ld.1205887&sa=U&ved=2ahUKEwiU-IHcwKnoAhUBolwKHeZED2k4eBDF9AEwBnoECAUQAQ&usg=AOvVaw1gctv422rtGJWrG317Qi5C
19:48:20;19/03/2020;Weise Voraussicht und gefährliche Nähe: Wie Baustellen mit dem Corona-Virus umgehen | Luzerner Zeitung;Ein Handwerker klagt, dass klare Corona-Hygienevorschriften auf seiner Baustelle fehlen – es gibt aber auch positive Beispiele. Marco Morosoli 19.03.2020,...;https://www.luzernerzeitung.ch/zentralschweiz/zug/weise-voraussicht-und-gefaehrliche-naehe-wie-baustellen-mit-dem-corona-virus-umgehen-ld.1205864&sa=U&ved=2ahUKEwj9kOvcwKnoAhVjxaYKHb0lDb44ggEQxfQBMAl6BAgBEAE&usg=AOvVaw0cjMJGusBX2Z_VNbagJH9q
19:48:20;19/03/2020;Die Corona-Krise hält die Region in Atem;Wegen der Corona-Krise steht das öffentliche Leben in der Region praktisch still. Der Wucheblick liefert ein Update. Redaktion. Züriost. Donnerstag, 19.;https://zueriost.ch/news/2020-03-19/die-corona-krise-haelt-die-region-in-atem&sa=U&ved=2ahUKEwiE883dwKnoAhWEmFwKHeBFByg4jAEQxfQBMAJ6BAgIEAE&usg=AOvVaw2KR7bqKvq9bDb-1ZUOfsnV
19:48:20;19/03/2020;Dieser Arzt einer Luzerner Notfallpraxis fährt für den Corona-Test zu den Patienten | Luzerner Zeitung;Im Kampf gegen das Corona-Virus setzt das Permanence MedCenter im Bahnhof Luzern neu auf Hausbesuche – aus gutem Grund. Und in der Praxis in der Mall...;https://www.luzernerzeitung.ch/zentralschweiz/luzern/dieser-arzt-einer-luzerner-notfallpraxis-faehrt-fuer-den-corona-test-zu-den-patienten-ld.1205699&sa=U&ved=2ahUKEwjn3q_ewKnoAhXRh1wKHRVyC6Q4lgEQxfQBMAN6BAgHEAE&usg=AOvVaw1XNfibfYLNKxsWYkoiAN0P
19:48:20;19/03/2020;Dieser Arzt einer Luzerner Notfallpraxis fährt für den Corona-Test zu den Patienten | Luzerner Zeitung;Im Kampf gegen das Corona-Virus setzt das Permanence MedCenter im Bahnhof Luzern neu auf Hausbesuche – aus gutem Grund. Und in der Praxis in der Mall...;https://www.luzernerzeitung.ch/zentralschweiz/luzern/dieser-arzt-einer-luzerner-notfallpraxis-faehrt-fuer-den-corona-test-zu-den-patienten-ld.1205699&sa=U&ved=2ahUKEwi95pffwKnoAhXIy6YKHUvKDlc4oAEQxfQBMAF6BAgJEAE&usg=AOvVaw1Ou2XpJ_MXutKbL1aKX6Mo
19:48:20;19/03/2020;Die Corona-Drehscheibe des Kantons Graubünden;RSO-Redaktor spricht mit Mauro Casanova. Er nimmt bei Corona Comm täglich viele Anrufe entgegen.;https://www.suedostschweiz.ch/sendungen/2020-03-19/die-corona-drehscheibe-des-kantons-graubuenden&sa=U&ved=2ahUKEwii-dbhwKnoAhUNCZoKHZQoCd04vgEQxfQBMAJ6BAgIEAE&usg=AOvVaw0y-THy1pwPbz5YZucPkeVv
19:48:20;19/03/2020;Coronavirus: US-Immunologe macht Hoffnung auf schnelle Hilfe für Corona-Patienten;Sars-CoV-2US-Immunologe macht Hoffnung auf schnelle Hilfe für Corona-Patienten. Trotz aller Bemühungen ist ein Impfstoff gegen das neuartige Coronavirus...;https://www.stern.de/gesundheit/coronavirus--us-immunologe-macht-hoffnung-auf-schnelle-hilfe-fuer-corona-patienten-9187734.html&sa=U&ved=2ahUKEwii-dbhwKnoAhUNCZoKHZQoCd04vgEQxfQBMAZ6BAgCEAE&usg=AOvVaw2_BSVdIs6rqMy1VZtF0b4a
19:48:20;19/03/2020;Strategie zum Umgang mit Coronavirus: Herdenimmunität oder Shutdown - was ist besser?;Großbritannien und die Niederlande zögerten, das öffentliche Leben wegen der Corona-Verbreitung einzuschränken. Das Virus sollte alle infizieren, die gut...;https://www.spiegel.de/wissenschaft/medizin/corona-herdenimmunitaet-gegen-shutdown-was-ist-besser-a-2b124ee6-4614-4a4b-96a0-e393f2cfeff9&sa=U&ved=2ahUKEwjP_MPiwKnoAhUs86YKHfHsB7U4yAEQxfQBMAd6BAgEEAE&usg=AOvVaw1S-QW7NCbtrcVfCCeVIQki
19:48:20;19/03/2020;Linke Verschwörungstheorie über Corona: „Im Labor entwickelt“;Linke Verschwörungstheorie über Corona: „Im Labor entwickelt“. Der Hamburger Linken-Abgeordnete Mehmet Yildiz erkennt in der Pandemie den...;https://taz.de/Linke-Verschwoerungstheorie-ueber-Corona/!5669065/&sa=U&ved=2ahUKEwjuq5fkwKnoAhX7w8QBHQmjCYg43AEQxfQBMAZ6BAgFEAE&usg=AOvVaw1E6i7o-DnuaWOIMiuYIvn_
19:48:20;19/03/2020;BAMF in der Corona-Krise: Personalrat fordert Stopp von Asylanhörungen;"BAMF in der Corona-Krise Personalrat fordert Stopp von Asylanhörungen. Stand: 19.03.2020 19:34 Uhr. Icon facebook; Icon Twitter...";https://www.tagesschau.de/investigativ/ndr-wdr/corona-bamf-101.html&sa=U&ved=2ahUKEwjuq5fkwKnoAhX7w8QBHQmjCYg43AEQxfQBMAd6BAgGEAE&usg=AOvVaw3z0A0QC_mll7rfynS1bfub
19:48:20;19/03/2020;BAMF in der Corona-Krise: Personalrat fordert Stopp von Asylanhörungen;"BAMF in der Corona-Krise Personalrat fordert Stopp von Asylanhörungen. Stand: 19.03.2020 19:34 Uhr. Icon facebook; Icon Twitter...";https://www.tagesschau.de/investigativ/ndr-wdr/corona-bamf-101.html&sa=U&ved=2ahUKEwiv0P7kwKnoAhVRzqYKHdWHDk045gEQxfQBMAB6BAgCEAE&usg=AOvVaw1GdTOrYVo8Tb8ahV7G1IZm
19:48:20;19/03/2020;Im Kanton Solothurn ist das mobile Corona-Test-Team unterwegs;Im Kanton Solothurn ist das mobile Corona-Test-Team unterwegs. 2 min. Die mobilen Testerinnen und Tester überprüfen Menschen mit...;https://www.telem1.ch/aktuell/im-kanton-solothurn-ist-das-mobile-corona-test-team-unterwegs-137195210&sa=U&ved=2ahUKEwiv0P7kwKnoAhVRzqYKHdWHDk045gEQxfQBMAl6BAgAEAE&usg=AOvVaw09f1qqETr0Vz4l-FpTn045
19:48:20;19/03/2020;Abseits der Corona-Krise: In Bonn gehen die Kinderärzte aus;Nicht nur in Zeiten der Corona-Pandemie ist die ärztliche Versorgung im Bonner Stadtgebiet für viele Bürger ein Thema. Immer weniger Ärzte versorgen immer...;https://www.general-anzeiger-bonn.de/bonn/in-bonn-gehen-die-kinderaerzte-aus_aid-49651901&sa=U&ved=2ahUKEwjNhs_mwKnoAhV7wsQBHUYMB1s4-gEQxfQBMAF6BAgJEAE&usg=AOvVaw3Duinq_FtNWgoPkMTnBmfo
19:48:20;19/03/2020;Corona-Virus: Laut Bericht beraten Kanzlerin und Länder über Ausgangssperren am Sonntag;Deutschlands Bundeskanzlerin Angela Merkel und die Ministerpräsidenten der Länder wollen an diesem Sonntag über Ausgangssperren in der Corona-Krise...;https://www.rollingpin.ch/news-events/corona-virus-laut-bericht-beraten-kanzlerin-und-laender-ueber-ausgangssperren-am-sonntag&sa=U&ved=2ahUKEwjF7qDowKnoAhWmyqYKHRtOAkA4jgIQxfQBMAd6BAgCEAE&usg=AOvVaw2biddM9LhRXrnOPuXa3ltG
